adId,startDate,brand,productType,color,environment,features,marketingApproach,description
"44","2025-01-14","Unknown","footwear","white;orange","urban/skate steps","performance skate shoe;modern color accents","youthful rebellion;action-oriented","The advertisement features a pair of sneakers designed for skateboarding, prominently displayed on a skateboard in an urban setting. The sneakers are white with orange accents, paired with blue socks, immediately catching the eye with their trendy color combination. This visual choice underscores a modern aesthetic that appeals to younger audiences who view skateboarding not just as a sport, but a significant element of their lifestyle and fashion identity. The background of concrete steps reinforces their urban suitability, indicating these sneakers are ideal for city terrains and skateparks. There is a clear emphasis on the practical and stylistic features of the product, such as durability and comfort, cleverly amalgamated with visual cues of youthful rebellion and freedom associated with skate culture. By focusing on the sneakers in action, the ad communicates that this product supports an active, fashionable lifestyle, catering to those who want both style and functionality in their footwear. This blend of allure and practicality makes the ad resonate strongly with its target demographic."
"45","2025-01-14","Vans","footwear","black;white","studio/concrete backdrop","checkerboard slip-on;timeless design","nostalgia;simplicity","The advertisement features a pair of Vans Checkerboard Slip-Ons placed against a rugged concrete backdrop, emphasizing a casual and urban aesthetic. This choice of background contrasts effectively with the bold, black-and-white checkerboard pattern of the shoes, drawing attention to their distinctive design. Lighting is natural, casting realistic shadows that enhance the three-dimensional appearance of the sneakers, and convey a sense of authenticity and simplicity. This visual presentation resonates with both nostalgia and timelessness, capitalizing on the shoes' historical importance in fashion culture. The choice to display the shoes in such a straightforward manner allows the product to speak for itself, underscoring its practicality and trendiness for everyday wear. The advertisement is strategically composed to capture a blend of style, comfort, and versatility, without the need for excessive text or complex visuals. This effectiveness lies in the recognition of the brand and design, appealing to both long-time fans and new customers seeking a blend of style and ease."
"46","2025-01-14","Unknown","footwear","","skate/wooden box","thick soles;action-ready","rebellion;subculture","The advertisement showcases a pair of skateboarding shoes artfully positioned on a rugged, distressed wooden box. This setting captures the essence of skate culture, which is often associated with rebellion, grit, and toughness. The shoes are prominently displayed, emphasizing their sleek design and thick, durable soles, hinting at their suitability for intense skateboarding sessions. The visual composition suggests that these shoes are made for action and resilience, elements critical to the skater identity. The absence of additional text or overlays allows the product to speak for itself, relying on the visual storytelling of the environment. The dark, worn background further deepens the notion of toughness and endurance, appealing directly to a youthful, adventurous audience. This concept plays into psychological appeals of belonging and identity, presenting these shoes as a natural choice for those who define themselves through skate culture. Overall, the ad effectively merges product functionality with an authentic cultural aesthetic, making it compelling to its target market."
"47","2025-01-14","Vans","footwear","white;light brown","urban/concrete","detailed craftsmanship;casual style","lifestyle;brand loyalty","The advertisement image for Vans sneakers effectively communicates both style and practicality, appealing primarily to a fashion-conscious audience seeking a blend of everyday comfort and trendy design. The close-up shot focuses intently on the sneaker's design, highlighting its white color with light brown accents that suggest a sense of modern simplicity. The concrete background underscores the urban appeal of the product, positioning it as suitable for everyday use in a city environment. The Vans logo is prominently displayed, leveraging brand recognition to attract loyal customers and new buyers alike. This ad does not rely on text; instead, it lets the visual elements speak for themselves, aligning with psychological principles of brand loyalty and aspirational purchase. By focusing on the sneaker's aesthetic and detailed craftsmanship, the image positions Vans as a trustworthy and desirable choice for those seeking both comfort and style, thus making it an effective piece of advertising."
"48","2024-09-11","Vans","footwear","lavender;white","studio/white background","checkerboard pattern;nostalgia;cultural relevance","minimalism;brand authenticity","The advertisement features a single Vans checkered sneaker prominently displayed against a plain white background. This minimalist approach ensures that full attention is given to the sneaker, emphasizing its design details and brand identity. The checkered pattern is iconic to Vans, immediately recognizable and associated with a sense of nostalgia and cultural relevance within skate and casual fashion. The lavender and white color scheme adds a modern twist, appealing to contemporary fashion trends while maintaining the brand's classic look. The sneaker's durable sole and construction are subtly highlighted, aligned with Vans' reputation for resilient and stylish footwear. The absence of clutter or additional text directs focus solely towards the product, effectively capturing the consumer's attention and conveying a message of simplicity, style, and authenticity. Overall, the ad succeeds in delivering a powerful visual statement about the sneaker's enduring appeal and versatility, reinforcing Vans' position as a staple in casual fashion."
"49","2024-08-22","Unknown","apparel","white","studio/plain background","long-sleeve t-shirt;checkerboard accent","minimalism;everyday comfort","The advertisement features a minimalistic presentation focused on a long-sleeve t-shirt, designed to communicate both style and comfort. The visual focus is on the product itself, highlighted by a simple backdrop that doesn't distract the viewer. The t-shirt is white with a small, subtle checkerboard pattern, suggesting a fusion of trendy design and minimalism. This appeals to potential buyers seeking versatile wardrobe staples. Emotional triggers such as the desire for comfort and the aspiration for effortless style are subtly leveraged to connect with the viewer's everyday needs. By focusing primarily on the product without additional visual clutter or messaging, the ad efficiently communicates its core value propositions. This strategic minimalism both enhances the product's appeal and suggests a straightforward brand ethos. The advertisement's effectiveness lies in its ability to convey essential information clearly and attractively, making it easy for consumers to visualize the product in their own lives."
"50","2025-01-14","Vans","footwear","leopard print","urban cityscape","collaboration;bold style;durability","exclusivity;personal expression","The ad effectively captures an urban lifestyle with a focus on the Vans x Copeland shoes, which are prominently displayed in a dynamic pose. This photograph shows a person sitting besides an urban cityscape, with their stylish leopard print Vans clearly visible. The angle of the photo, along with the city backdrop featuring a fence and tall buildings, suggests a trendy, urban lifestyle that resonates with the target audience of young, style-conscious individuals. The shoes, featuring a distinctive leopard print, are highlighted through a close-up focus that emphasizes their unique design and builds on the brand’s reputation for individuality and durability. Collaborations like this with notable figures or sub-brands like Copeland add a layer of exclusivity, leveraging social proof and inviting consumers to express personal style uniquely. This positions the product not only as fashionable but as an essential part of a bold, adventurous lifestyle, backed by the credibility and trendsetting of the Vans brand."
"51","2025-01-14","Vans","footwear","","indoor/music room","creative lifestyle;comfortable footwear","community;music culture","This advertisement successfully captures a relaxed and creative atmosphere that appeals to a youthful, music-loving demographic. The image features two individuals playing electric guitars in a cozy room, with their Vans sneakers prominently displayed. The casual setting, complete with a patterned rug and comfortable seating, supplements the core message of style and comfort. This setting effectively positions Vans as an integral part of daily life, associating it with creativity and leisure. The ad uses visual storytelling to integrate the product naturally, showing it as part of an everyday scene. The emphasis on lifestyle and personal expression through music is compelling, establishing an emotional connection with the viewer. This ad doesn't need explicit text or overlays; instead, it communicates through powerful imagery that underscores Vans' brand positioning— a blend of timeless style and functionality fit for various everyday scenarios. By portraying the product in action within a real-world context, the ad appeals to aspirational and nostalgic emotions, encouraging potential customers to envision themselves in similar scenarios."
"52","2025-01-14","Vans","footwear","black;white","urban street","checkerboard slip-on;iconic design","nostalgia;FOMO","This advertisement for Vans Checkerboard Slip-On shoes effectively conveys a sense of casual style through strong visual and emotional appeals. The image depicts a close-up view of a foot donning the iconic checkerboard patterned Vans, placed on an urban street. This strategic focus on the shoe highlights its distinct design while positioning the product within a setting that resonates with urban street culture—an integral part of the Vans brand identity. The mood is set by the clear skies and street background, which enhance the laid-back, everyday accessibility of the shoes. The ad leverages the principle of nostalgia through the recognition of the classic Vans design, sparking emotional connections to past experiences or desired lifestyles. Additionally, the ad capitalizes on the Fear of Missing Out (FOMO) by suggesting an affiliation with a stylish, effortless way of living that consumers can attain. By integrating product utility with a lifestyle narrative, the ad creates a compelling call to action for its target demographic."
"53","2025-01-17","Unknown","apparel","","urban/escalator","metropolitan fashion;young demographic","lifestyle;aspiration","The advertisement depicts two young individuals casually positioned on an escalator, dressed in trendy, urban apparel. The setting, with clear urban architectural elements, enhances the backdrop to reinforce the advertisement's target demographic, which is youthful, fashion-conscious individuals living in metropolitan environments. The choice of models and their relaxed demeanor lend an air of modern coolness to the ad, capitalizing on aspirations of effortless style. The fashion featured prioritizes both comfort and trend alignment, suggesting clothes suited for a dynamic, everyday urban lifestyle. There is a clever leveraging of angles and perspectives; the low-angle positioning highlights the models as they ascend, metaphorically tying into themes of upward urban mobility and ambition. Despite the absence of typographic overlays or explicit brand messages, the power of visual storytelling comes through—the apparel speaks to a balance of style, comfort, and urban identity. The advertisement's effectiveness lies in its closing of the gap between aspirational and attainable fashion, placing urban fashion within easy reach of its youthful target audience."
"54","2025-01-14","Vans","footwear","black;white","live music stage","Old Skool sneakers;performance vibe","community;emotional connection","This advertisement captures a high-energy moment during a live music performance, focusing on two musicians, both wearing Vans Old Skool sneakers. The imagery emphasizes the brand's connection with the music scene, showcasing the footwear as stylish and essential for musicians. The photo's vibrant colors and dim stage lighting set a lively and authentic mood, drawing the viewer's attention. The presence of pedal boards and instruments highlights the musicianship aspect, suggesting that Vans are as integral to a musician’s identity as their gear. The text overlay 'I JUST' adds a casual, relatable phrase, aligning with the brand's ethos of effortless cool. This combination of lifestyle context, emotional appeal through community connection, and promotional visuals makes the ad compelling, positioning Vans as the footwear of choice for creatively inclined individuals. It effectively uses visual storytelling to evoke aspiration and a sense of belonging in viewers who identify with or admire the music lifestyle."
"55","2025-01-30","Vans","footwear","","skate park (video ad)","Skate Old Skool 36+;90s inspired design;reinforced for skateboarding","nostalgia;high-energy action","The video ad for the Vans Skate Old Skool™ 36+ seamlessly combines dynamic and energetic visuals with targeted messaging to appeal to its intended audience of skateboarders. It opens with action-packed scenes of skateboarders performing impressive tricks in a vibrant skate park, immediately capturing attention and setting an energetic tone. The ad effectively uses a combination of imagery and overlay text to communicate its core messages. The primary message, 'Feel Something New,' is strategically emphasized and coupled with '‘90s Inspired Design,' which taps into the emotional appeal of nostalgia. This positions the product as a modern iteration of a classic design, appealing to both new skateboarders and those with a penchant for vintage styles. The ad also highlights the product's functionality through the message 'Reinforced for skateboarding,' suggesting durability and performance. Close-up shots feature the product's design elements, further reinforcing its stylish yet practical appeal. The use of overlay text is impactful throughout the narrative, ensuring that viewers receive the key messages even amidst high-action sequences. The consistent branding, using the 'Vans' logo overlays, ensures brand recall. Additionally, the depiction of real-life skateboarding scenarios connects with the target audience's lifestyle and interests, enhancing relatability and desirability of the product. The ad's structure, beginning with high-energy action, then delving into product details, and concluding with brand messaging, keeps viewers engaged. By leveraging action, nostalgia, and effective visual storytelling, Vans' ad employs a comprehensive approach that not only highlights the product's features but also connects emotionally with the audience, making it effective and memorable."
"56","2025-01-14","Vans","footwear","","multiple terrains (video ad)","ALL-TERRAIN TRACTION;LIGHTWEIGHT BREATHABILITY","performance;real-world demos","This advertisement effectively highlights the all-terrain capabilities of sneakers designed for rugged and urban environments. It uses rapid cuts and dynamic camera work to immediately engage the viewer by showcasing the sneakers in action, starting with a close-up of the wearer adjusting the shoes and then transitioning into scenes that show various scenarios where the footwear excels. The ad emphasizes the sneakers' versatility by showing their performance on snow, wet roads, and rugged terrain, reinforcing the message of all-terrain traction. This is further strengthened by the text overlays that serve as visual affirmations of the sneakers' benefits, such as 'ALL-TERRAIN TRACTION' and 'LIGHTWEIGHT BREATHABILITY.' The ad successfully employs real-world applications as it demonstrates how these sneakers perform under conditions that challenge regular footwear, hence backing up claims with visual evidence. This practical approach also serves to reassure potential customers of the product's reliability, effectively reducing doubt and increasing purchase intent. By focusing on the sneakers' specific features like enhanced grip and support in adverse conditions, the ad makes these elements its unique selling proposition, ensuring the benefits are both understood and appealing. The environment setting shifts between urban and natural terrains, visually communicating that these sneakers are suitable for both everyday wear and adventurous endeavors. The messaging is clear and direct, ensuring viewers understand the product's value propositions, namely, comfort, support, and adaptability. Through visual storytelling, this ad highlights common issues faced by regular footwear and positions its solution overtly, achieving a compelling narrative that is likely to resonate with active lifestyle aficionados or anyone needing reliable footwear for unpredictable surfaces."
"57","2025-01-14","Vans","footwear","","urban skate","25 years collaboration;Rowley signature;performance enhancement","authenticity;testimony","This ad centers around the celebrated collaboration between Vans Footwear and a professional skateboarder, marking 25 years of their partnership. The video showcases a series of action-packed skateboarding scenes, displaying the skill and expertise honed over this time. The narrative starts with the skateboarder sharing how Vans shoes transformed their performance from the very first skate shoot, emphasizing how the brand crafted footwear that met his specific demands and subsequently boosted his confidence, making him a better skateboarder. This continuity in support and quality is visually represented through dynamic scenes of skateboarding tricks and urban environments, accompanied by reflective shots of the iconic shoes. A textual overlay reiterates the duration and strength of this partnership by highlighting '25 YEARS OF VANS AND [ROWLEY].' The ad leverages authenticity, nostalgia, and trust, which significantly resonates with the target audience. The visual storytelling effectively uses reflective imagery—depicting both the shoe and its journey—symbolizing the enduring quality and relationship with the brand. These elements combined with the personal testimonial of a professional create a powerful message about reliability, performance enhancement, and a product that's been trusted for decades. The overall tone is one of authenticity and aspirational performance, conveyed through compelling visuals and a narrative that underscores the skateboarder's journey with Vans."
"58","2025-01-14","Vans","footwear","","sand/wet surfaces (video ad)","MTE Crosspath;full-foot support;all-terrain traction","adventure;technical","The advertisement for Vans MTE Crosspath is staged strategically to showcase the shoe's adaptability and versatility across various terrains and conditions. The ad begins with clear shots of the shoe, emphasizing its lightweight and breathable nature with the overlay text 'LIGHTWEIGHT BREATHABILITY.' This tactic serves as a hook to capture the attention of viewers, particularly those looking for comfortable footwear for various activities. As the ad progresses, it shifts to feature the shoes being worn in practical settings – on sand, wet surfaces, and urban streets – to demonstrate 'FULL-FOOT SUPPORT' and 'ALL-TERRAIN TRACTION.' These shots are dynamic, highlighting the shoes' movement and adaptation to the environment, reinforcing their practical benefits. The calculated use of text overlays on visuals serves to direct viewers' attention and ensures that key messages are communicated clearly and succinctly. In the concluding frames, viewers see the shoes being worn in a daily urban setting with the text 'MTE Crosspath. Always Ready.' This acts as a solid frame for the product, linking it to real-world applicability and promoting its universal use. The overall mood of the ad is practical and adventurous, appealing to individuals who value readiness and multi-functionality in their purchases. By focusing on both urban and natural scenes, the ad appeals to a broad audience, from city dwellers to outdoor enthusiasts, illustrating the MTE Crosspath's versatility as a standout feature. The visuals are complemented by the straightforward, text-driven messaging that resonates simplicity and clarity, vital for driving home the product's benefits. This ad's effectiveness lies in its ability to exhibit the product utility clearly, target a broad audience, and underline the brand's message of readiness and adaptability."
"59","2025-01-14","Vans","footwear","","snow/wet terrain (video ad)","MTE Crosspath;lightweight;support","practicality;adventure","The advertisement for Vans MTE Crosspath shoes by Vans emphasizes the product's versatility and readiness in various weather conditions through a series of dynamic and visually engaging frames. The ad opens with a close-up view of the shoes against a concrete background, introducing the product and its promise with text overlays stating 'The MTE™ Crosspath' and 'Always Ready.'. Each frame shows quick-paced action shots of the shoes on different terrains such as concrete, snowy patches, and wet surfaces, emphasizing their adaptability and robustness. The bright red socks worn by the model provide a stark color contrast, drawing attention to the shoe and adding a fashion-forward element to the utilitarian message. The frames utilize close-ups and focus on the shoe's motion and contact with the ground, showcasing the grip and design features critical for outdoor use. The text overlays are strategically placed to reinforce the brand identity and product promise without overburdening the visual story. The message concludes with Vans' logo, reinforcing brand recognition and leaving a lasting impression. Such imagery, supported by minimal yet impactful text, speaks directly to the target audience who are likely outdoor enthusiasts or urban explorers, seeking reliable yet stylish footwear. The ad is effective because it succinctly communicates the core benefit of the product—its readiness and reliability in various environments—through consistent and strategically crafted imagery and messaging."
"60","2025-01-14","Vans","footwear","","snowy urban (video ad)","MTE Crosspath;confidence in adverse weather","visual demonstration;adventure","The advertisement for The MTE Crosspath footwear begins with a compelling introduction displaying the shoes in action over snowy terrains. The opening scenes capture the attention by showcasing a young person confidently navigating an icy urban environment, immediately highlighting the shoe's all-terrain traction feature. Text overlays such as 'The MTE Crosspath' and 'ALL TERRAIN TRACTION' are prominently displayed, reinforcing the main selling points. Throughout the video, individuals of diverse backgrounds actively engage in outdoor adventures, walking and running through snow-laden paths, illustrating the product's effectiveness in real-world scenarios. The ad strategically switches between close-ups of the footwear and wider shots of the environment, effectively presenting the shoes' full-foot support feature with overlays like 'FULL-FOOT SUPPORT'. The use of vibrant clothing contrasts with the snowy backdrop, keeping the visual focus on the active lifestyle theme while subtly conveying a sense of warmth and comfort offered by the shoes. The ad builds a narrative that aligns with the brand's positioning: empowering users to tackle any terrain with confidence. Towards the end, a close-up shot of the shoes prominently features the brand logo 'VANS', while reiterating key product features such as 'LIGHTWEIGHT BREATHABILITY'. The strategy integrates both aesthetic appeal and technical messaging, appealing to the viewer's desire for reliable, stylish outdoor footwear. This multi-faceted approach effectively delivers the shoes' unique selling propositions to the target audience."
