adId,startDate,brand,productType,color,environment,features,marketingApproach,description
"23","2025-01-14","Vans","footwear","","studio/black background","rugged sole;durable design","trendiness;quality","This advertisement from Vans effectively showcases their latest sneaker, emphasizing its stylish and durable design. The visuals are dominated by varying angles of the sneaker, including a top, side, and sole view, set against a stark black background that makes the product stand out vividly. This approach allows viewers to appreciate the shoe's aesthetic design and functional attributes, such as the rugged sole suggestive of high traction suitable for various terrains. The clean lines and modern design target a youthful audience, aligning well with Vans' brand identity as a trendy and reliable footwear choice. The ad taps into psychological principles like trendiness and perceived quality, appealing to consumers' desire for fashionable yet functional shoes. By strategically emphasizing both style and durability, the ad positions the product as a solution for those with active lifestyles who do not want to sacrifice style, effectively leveraging visual storytelling to engage and persuade potential buyers."
"24","2025-01-14","Vans","footwear","blue;white","indoor/retro sofa","checkerboard design;slip-on convenience","nostalgia;casual comfort","This advertisement effectively uses a blend of nostalgia and modern style to showcase Vans Slip-On Sneakers. Featuring a dynamic action shot of a child playfully jumping on a retro yellow sofa, the image captures the essence of carefree childhood combined with the brand's iconic checkerboard design. The shoes are displayed in a way that emphasizes their practicality and style, reinforcing Vans' positioning as a go-to for casual, comfortable footwear. The background, with its vintage texture, adds to the nostalgic appeal, while the vivid blue and white pattern of the sneakers creates a striking contrast, drawing attention directly to the product. The ad cleverly uses elements like ease of use and the emotional comfort associated with familiar, nostalgic scenes to make a compelling case for why consumers should choose Vans. This strategy not only taps into the desire for stylish footwear but also connects on a deeper emotional level by invoking feelings of warmth, familiarity, and joy."
"25","2025-01-14","Vans","footwear","black;white","studio/plain background","checkerboard print;slip-on design;nostalgic style","brand heritage;practicality","This advertisement features the iconic Vans Slip-On Checkerboard shoes, a staple piece in casual footwear recognized for its distinctive design. The visual element is minimalistic, with a side profile of the shoe against a plain background, ensuring that the viewer's focus is solely on the product's details such as its checkerboard pattern and slip-on design. This simplicity aids in the quick recognition of the brand's heritage and iconic style that Vans is known for. The ad successfully leverages emotional nostalgia, appealing to audiences familiar with Vans' established presence in casual fashion. Additionally, it underscores the practicality of the slip-on feature, combining style with ease of use, which broadens its appeal to a lifestyle that values both fashion and functionality. Overall, the ad effectively communicates these elements through a straightforward presentation that speaks directly to Vans' target demographic, making it a powerful and memorable marketing piece."
"26","2025-01-14","Unknown","footwear","orange","cityscape","bright color design;rugged soles;urban exploration","adventure;freedom","This advertisement features a pair of vibrant orange sneakers, positioned as the perfect combination of style and durability for outdoor adventures. The image features the sneakers worn on feet lifted against a blurred cityscape background, symbolizing freedom and the vibrant spirit of exploration. The ad effectively conveys a sense of adventure and the ruggedness needed for such activities through its imagery. The rugged soles and secure lacing suggest preparedness for the outdoors, while the bright color and design capture the attention, highlighting the sneakers' stylistic appeal. Adventure enthusiasts and urban explorers are likely the target audience, drawn in by the brand’s positioning of blending fashion with function. The visual emphasis on the shoes in action reinforces their practical application in real-life settings, making the ad both aspirational and relatable. The use of aspirational trigger ties these sneakers to a lifestyle of freedom and boundless exploration, effectively leveraging emotional appeal to connect with prospective buyers."
"27","2025-01-14","Unknown","apparel","","snowy urban","hoodie;vest;warm winter wear","comfort;winter necessity","This advertisement for winter apparel features a stylish and functional piece of clothing designed for cold weather. The image displays a person dressed in a warm-looking hoodie and vest against a snowy, urban backdrop, exemplifying living in style while staying warm. The dominant visual narrative is the individual's comfort and warmth despite the cold surroundings. The ad's mood is inviting, presenting the apparel as a necessity for embracing and enjoying winter conditions. By emphasizing the contrast between the snowy environment and the cozy clothing, the ad effectively creates a visual metaphor of 'warmth amidst the cold.' The product itself is depicted in use, reinforcing its practical application while showcasing its fashionable appeal. The ad leverages psychological triggers like FOMO, suggesting limited availability and urging potential buyers to act fast. This combination of lifestyle depiction, product focus, and psychological appeal makes the advertisement effective and engaging."
"28","2025-01-14","Vans","footwear","","outdoor/nature","camo pants synergy;adventure-ready;reliable footwear","rugged aesthetic;lifestyle","This advertisement focuses on promoting Vans sneakers as the ideal footwear choice for those who value a blend of style and durability. By showcasing the shoes perched on a rock amidst a lush, natural environment, the ad connects the product directly with outdoor adventures. The camo pants further accentuate a rugged, adventurous theme, reinforcing the idea that these sneakers are not just for urban use, but also ready for escapades in nature. The aesthetic choice of earthy tones complements the shoe's design, while the subtle lighting effects add a warm, inviting feel. These visual elements combined with the renowned Vans branding suggest reliability and trendy style, pointing at a market of young, adventurous individuals looking for shoes that can seamlessly transition from city streets to hiking trails. By leveraging the narrative of 'step into adventure,' Vans effectively engages consumers who aspire to live an active, multifaceted lifestyle. This ad excels in portraying a versatile product suitable for a variety of environments and activities, making it both practical and desirable."
"29","2025-01-14","Vans","footwear","","studio/black background","Ultrarange EXO MTE-1;weather resistance;enhanced traction","technical appeal;adventure","The advertisement presents Vans Ultrarange EXO MTE-1 shoes in a visually focused manner, emphasizing the product's suitability for all-terrain and all-weather conditions. It strategically uses a solid black background which allows the viewer's attention to remain fixed on the shoes that are shown from different angles. This tactically showcases their design, grip, and durability. Core messaging revolves around the blend of style and utility, targeting those who are adventurous but also fashion-conscious. The shoe is promoted as offering weather resistance and enhanced traction, which are key features for those needing reliable outdoor footwear. There is no use of humor or tension; instead, the ad relies on practical appeal through its demonstration of product features. The branding is subtly reinforced through clever logo placement on different shoe angles, ensuring brand recall. The emotional appeal of adventure and security is invoked, making it effective in drawing in target customers looking for shoes that can transition between different settings and conditions."
"30","2025-01-14","Vans","footwear","","urban/wood pallets","iconic Vans logo;durability;street style","brand-driven;social proof","This advertisement for Vans sneakers effectively combines branding with an urban style that appeals to a targeted market segment seeking fashionable yet comfortable footwear. The close-up image showcases the sneakers' design, which features the iconic Vans logo prominently, aligning with brand loyalty and recognition. The choice of a rugged background with wooden pallets and a concrete surface reinforces the urban and edgy tone of the ad. The dark color palette of the sneakers and attire reflects a modern aesthetic, appealing to young adults who embrace street style. The clear display of the brand name provides instant recognition, making it easy for consumers to connect emotionally and fashionably with the product. This ad leverages psychological elements such as social proof, where seeing the product in a typical urban scene communicates relevance and trendiness. By doing this, it effectively taps into the aspirations of the target audience, encouraging them to adopt the style presented. Overall, the ad integrates visually striking elements and brand-driven messaging to position Vans as the go-to choice for style enthusiasts."
"31","2025-01-14","Unknown","footwear","","urban/asphalt","sleek design;durability","fashion;influencer","The advertisement features a pair of trendy sneakers displayed prominently on an asphalt ground, suggesting durability and urban style. The clean, sleek look of the sneakers combined with subtle colors makes it visually appealing to a fashion-conscious audience. The close-up shot highlights the intricate detailing, ensuring the focus remains on the product's quality and design. The backdrop—a textured ground with slight greenery—adds an urban feel, appealing to modern, active individuals. The image overlay announces a 'New Collection Out Now!', creating urgency and a call to action for viewers. The strategic use of an influencer in the fashion industry as an endorsement tactic leverages trust and social proof, enhancing the perceived value. This ad combines effective visual storytelling, demonstrating real-world application, alongside clear messaging about style and comfort, making it persuasive for potential buyers seeking both fashion and durability in their footwear options."
"32","2025-01-14","Vans","footwear","leopard print","studio/plain background","bold pattern;slip-on convenience","individuality;trendiness","This advertisement showcases a Vans slip-on shoe with a striking leopard print design. The shoe is positioned against a plain background, enhancing its standout feature: the bold pattern. Vans, a brand synonymous with youth culture and casual style, leverages its iconic status to appeal to fashion-conscious individuals. The slip-on design suggests ease and comfort, ideal for both casual outings and fashion statements. By focusing solely on the shoe, the ad underscores its unique design, reinforcing the idea that it’s not just footwear but a fashion statement. The minimalist background ensures no distractions, directing the viewer's attention entirely on the product. This approach aligns with consumers' desires for individuality and style. Furthermore, the ad captures the essence of Vans - effortlessly blending comfort with trendiness, appealing to both brand loyalists and new customers alike. The overall tone is bold and confident, conveying a message of self-expression and modern style."
"33","2025-01-14","Vans","footwear","black;white","studio/plain background","Old Skool design;reinforced toe caps;timeless appeal","nostalgia;skate heritage","The advertisement for the Vans Old Skool skate shoe effectively focuses on its iconic design, appealing to both skaters and fashion-conscious individuals. The visual presentation is clean and minimalistic, showcasing the shoe against a plain white background. This approach not only draws attention to the shoe's distinctive style but also highlights its functional attributes like the durable suede and canvas materials and reinforced toe caps, praised by skaters for their reliability. The image underlines the brand's classic and timeless appeal, tapping into nostalgia while aligning with current style aspirations. Psychological principles such as nostalgia and identity expression are leveraged, making it not just an appealing addition to a wardrobe, but a statement of personal style. The ad subtly invokes a fear of missing out by portraying the shoe as an essential item for those in skate and street fashion circles, relying on viewers' existing brand loyalty and desire for social belonging. This blend of visual clarity and strategic messaging makes the advertisement both engaging and persuasive."
"34","2025-01-14","Unknown","footwear","black","industrial/ice patches","winter boot;textured tread;slip-resistant","safety;winter reliability","This advertisement effectively captures the essence of its product—a robust winter boot designed for rugged conditions. The close-up shot of the boot's sole dominates the composition, showcasing its core feature: a highly textured tread pattern for enhanced grip. Positioned on a concrete surface with ice patches and metal stair railing, the setting illustrates the boot's capability to handle tough, icy environments, directly addressing the fear of slipping. The use of industrial imagery adds to the perception of reliability and toughness, vital attributes for this product category. By using a low-angle shot, the ad creates a perspective of dominance and assurance, instilling confidence in prospective customers. The boot appears sturdy and well-designed, targeting individuals who need both protection and comfort in winter conditions. This visual story effectively communicates a reassurance of safety and warmth, key emotional triggers that resonate strongly during the winter months."
"35","2025-01-14","Unknown","footwear","","outdoor/nighttime","casual sneakers;everyday comfort","youthful;lifestyle","The advertisement features a relaxed, casual setup with a young person sitting outdoors at night. The main focus of the image is the sneakers the individual is wearing, which are prominently displayed. This setting and pose are chosen to convey authenticity and a laid-back lifestyle, aligning well with the target demographic of casual and youthful consumers. The individual's smiling expression, combined with the dark yet calm night-time setting, evokes feelings of warmth and confidence attributed to self-expression and comfort. The absence of heavy graphics or text overload allows the viewer to focus on the real-world application of the sneakers in a relatable scenario. The advertisement effectively leverages emotional appeal through the subject’s positive facial expression, suggesting that the product provides comfort and happiness in everyday moments. Such visual storytelling enhances the alignment with consumers’ lifestyle aspirations, making it memorable and encouraging product association with comfort and style."
"36","2025-01-14","Vans","footwear","light blue","urban","durability;comfort","product focus;lifestyle","This advertisement effectively communicates the dual appeal of style and comfort that Vans sneakers provide. It features a close-up image of a person holding a pair of light blue Vans sneakers in a casual urban setting, which suggests everyday usability and trendiness. The concrete ground and shadows add to the urban, on-the-move aesthetic that resonates with modern lifestyles. The ad's subtle use of brand logos and messaging keeps the focus on the product, reinforcing Vans’ brand positioning as a leader in lifestyle footwear. The tactile emphasis on product properties—durability and comfort—is visually communicated through the sneakers' design and color palette. The absence of direct endorsements in the image but reliance on the product's allure and persona reflects a psychological appeal to those aspiring for comfort without compromising on style. This ad would appeal alert audiences who feel the FOMO (Fear Of Missing Out) effect, desiring to keep up with trends and being part of a larger community or culture."
"37","2025-01-14","Unknown","footwear","white","urban/skate","skateboarding context;versatile sneaker","freedom;youth culture","This advertisement features a pair of white sneakers positioned within the context of skateboarding culture, an emblematic representation of youthful, dynamic, and trendy fashion. The sneakers are paired beside a skateboard, accentuating an active lifestyle, making it attractive to a young, urban audience intertwining seamless comfort with street style. This blend of lifestyle imagery with product centrality communicates a strong message of cultural relevance and practicality. The ad’s urban background further underscores the brand’s alignment with the youthful and energetic world of skating. With clean visuals emphasizing comfort, durability, and style, it speaks directly to the target audience’s aspirations. This concise visual narrative is enriched through its strategic positioning of the product within action shots, inviting potential customers into the brand's story of freedom and trend-savviness whilst fostering an emotional connection to a youthful, energetic demographic that values individual style and comfort-oriented functionality."
"38","2025-01-14","Unknown","footwear","black;white","urban/denim setting","high-top design;comfortable fit;modern aesthetic","confidence;street style","The advertisement showcases a pair of high-top sneakers, primarily focusing on their design and style. The product is a pair of black sneakers with white laces and an iconic design stripe, set against a blurred background that suggests a casual urban setting. The denim jeans hint at a relaxed lifestyle, reinforcing the sneakers’ versatility for everyday wear. This ad uses close-up photography to highlight the unique selling propositions such as comfortable fit, durable build, and trendiness. The core messaging revolves around the theme of combining style with comfort, aiming to attract a youthful, fashion-conscious audience. The branding strategy leverages social proof and trendiness, tapping into emotional triggers of nostalgia and confidence. Overall, the ad effectively communicates the brand's positioning as a trendy, lifestyle-oriented choice, while the visual focus on the product's design aids in capturing consumer attention and promoting brand loyalty."
"39","2024-10-01","Vans","footwear","blue;green;yellow","studio/gray background","multicolor design;Old Skool silhouette","bold expression;nostalgia","The advertisement for Vans Old Skool Multicolor Sneakers uses a simplistic yet vibrant visual strategy to capture consumer attention, especially targeting a youthful and trendy demographic. The multicolored sneaker is prominently displayed against a plain gray backdrop, which serves to enhance the vibrant blues, greens, and yellows of the shoe itself, focusing the viewer’s attention entirely on the product. This design choice taps into popular culture, where bold expressions of style are highly valued, thus appealing to individuals looking to make a statement. The sneaker's classic silhouette speaks to Vans’ established reputation for merging style with comfort and durability. Furthermore, there are no additional textual overlays on the image, allowing the product's color and form to do all the talking. This focus on product aesthetic aligns with principles of aesthetic appeal and individuality, implying that wearing this sneaker allows one to express personal style effortlessly. The ad leverages social proof through implicit associations with athletes and influencers, making a compelling case for both new and loyal customers."
"40","2025-01-14","Unknown","footwear","turquoise","industrial backdrop","suede material;long-lasting","style meets durability;visual contrast","The advertisement features a pair of trendy turquoise suede sneakers prominently displayed against a rugged, industrial backdrop. The sneakers are positioned on a metallic surface, suggesting durability and providing a strong contrast to the vibrant shoe color. This visual technique highlights the sneakers as the focal point, emphasizing their stylish look and high-quality suede material. The advertisement effectively uses color contrast to draw attention, with the turquoise of the sneakers standing out against the darker background, enhancing visual appeal. By incorporating a setting that conveys ruggedness, the ad subtly communicates the product's durability and everyday utility, aligning with the core message that these sneakers are both fashionable and long-lasting. This approach appeals to consumers looking for a blend of style and practicality. The ad cleverly combines visual storytelling with psychological appeals, making it both engaging and memorable. This strategic use of visuals effectively positions the product as a desirable, stylish choice for those who wish to combine comfort with fashion."
"41","2024-10-01","Vans","backpack","lavender;black","studio/light grey background","minimalist design;Vans logo patch;practical storage","authenticity;simple utility","This advertisement features a Vans backpack prominently centered against a light grey background, accentuating the product's minimalist and functional design. The backpack is a soft lavender color with a black zipper and pocket detailing. A Vans logo patch is affixed to the front, linking the product to the brand's well-established reputation. The ad's simplicity effectively conveys the straightforward utility and style of the backpack without the clutter of additional graphics or text. Particularly, this approach aligns with Vans' brand image of being an authentic and reliable lifestyle choice. The clean background ensures that focus remains solidly on the product, allowing potential consumers to visualize the backpack's use in everyday scenarios such as school, work, or casual outings. The color scheme is subtle yet modern, appealing to individuals who appreciate understated elegance. By presenting the backpack in this manner, the advertisement effectively communicates the product’s dual nature as both a fashion accessory and a practical solution for carrying essentials."
"42","2025-01-14","Unknown","tote bag","red","outdoor/riverfront","casual style;vibrant color","lifestyle;youthful adventure","This advertisement features a casual and stylish tote bag brandishing a vibrant red color that catches the eye immediately. The scene portrays a young woman in a denim outfit, embodying a carefree and joyful attitude, which effectively communicates the brand's core messaging of fashion meeting functionality. The setting, an outdoor area along a river, evokes a sense of adventure and spontaneity, aligning perfectly with consumer desires for versatile and stylish accessories. The visual emphasis on the bright red bag provides a contrast with the more neutral background, ensuring the product remains the focal point. By using a relatable, lifestyle-centric imagery, the ad successfully engages viewers' aspirations for a trendy yet practical addition to their daily life. Altogether, the vibrant setting, emotional appeal of simplicity, and lifestyle association make this advertisement compelling and memorable, promoting the bag not just as a product but as a lifestyle enhancer."
"43","2025-01-14","Vans","footwear","","outdoor/palm trees","iconic side stripe;casual comfort","authenticity;nostalgia","This advertisement for Vans sneakers effectively communicates its message through simple yet impactful visual storytelling. The central element is a close-up shot of the sneaker, ensuring that the viewer's attention is immediately drawn to the product's design features, like the iconic side stripe and durable build. The background, slightly blurred, consists of palm trees and a car, creating a setting that suggests a relaxed and free-spirited lifestyle—a core part of the Vans brand ethos. This environment not only evokes nostalgic feelings of timeless style but also indicates the ease with which these sneakers fit into everyday life. The ad leverages the principle of familiarity, tapping into cultural associations with Vans as a staple in casual and skatewear circles. This approach builds trust and engagement without the need for textual overlays, relying instead on powerful imagery to convey a message of authenticity, comfort, and style. The result is an advertisement that succinctly highlights the brand's continuous relevancy and appeal across generations, making it not just a shoe, but a lifestyle choice."
