adId,startDate,brand,productType,color,environment,features,marketingApproach,description
"1","2025-01-30","Vans","footwear","blue","studio","sturdy construction;blue colorway;comfort;style","direct approach;aspirational;lifestyle","This advertisement effectively utilizes a direct approach to showcase a Vans sneaker. The sneaker is held in the foreground, drawing immediate attention to its design elements like the blue colorway and sturdy construction. The background is a simple blue, allowing the vibrant details of the shoe to pop visually. The visual focus on the shoe itself suggests a strong emphasis on the product's quality and style, appealing to a youthful and fashion-conscious audience. The ad communicates dual messages of style and comfort, aligning with Vans' brand positioning as a trendy and casual footwear provider. By using real-life representation without distracting elements, the ad evokes a sense of relatability and aspirational appeal, effectively engaging potential customers by suggesting a lifestyle associated with the product. The overall composition expresses confidence and modernity, making it an effective piece for drawing in viewers interested in both fashion and utility."
"2","2025-01-14","Unknown","apparel","","snowy urban","winter apparel;durability;style;warmth","adventure;lifestyle","This advertisement showcases outdoor winter apparel by displaying a dynamic and engaging scene involving a group of individuals interacting in snowy conditions. Their clothing is the focal point, emphasizing durability, style, and warmth. Each person is dressed in gear that is both practical for winter sports and visually appealing for fashion-conscious consumers. The scene suggests a sense of camaraderie and adventure, appealing to those who enjoy outdoor activities but refuse to compromise on style. The background presents a rugged, snowy urban environment that contextualizes the practicality of the gear, reinforcing its utility and design. The absence of text on the image itself ensures full visual focus on the scene, relying on viewers' interpretation to infer the qualities of the clothing. Incorporating real-world applications and depicting an authentic, unfiltered moment makes the ad relatable and aspirational, inviting viewers to experience similar adventures while staying stylish and well-equipped. This approach not only appeals to potential customers' desire for high functionality but also connects emotionally by tapping into their adventurous spirit."
"3","2025-01-14","Unknown","footwear","","urban/graffiti","sturdy outdoor sneakers;versatility;urban-rugged","FOMO;adventure","This advertisement paints a vivid image of a young, adventurous individual readying themselves for an outdoor excursion. The focus is on a pair of sturdy, fashionable outdoor sneakers, captured with the subject tying the laces on rustic wooden steps. The background features a graffiti-decorated brick wall, adding an urban and rugged feel to the scene. The visual elements work harmoniously to convey the brand's message of reliability, style, and readiness for adventure. By showcasing the product in a real-world application, the viewer easily connects the footwear to themes of exploration and activity. The vibrant clothing layers suggest versatility in various conditions, enhancing the product's appeal. Indirectly, it nudges at the FOMO (Fear of Missing Out) by presenting a lifestyle that is active and full of opportunities, urging consumers to be part of the adventure with the right gear. This ad effectively draws attention with its dynamic composition and practical messaging, positioning the sneakers as a must-have for the adventurous spirit."
"4","2025-01-14","Unknown","footwear","black;pink","urban/skate","action shot;reinforced sole;black and pink colorway","lifestyle;street culture","This advertisement efficiently marries the worlds of style and functionality with a focus centered on dynamic skateboarding. The upper section flaunts an action shot of a skateboarder engaging in a trick on an urban backdrop, suggesting not only the performance capabilities of the advertised shoe but also its alignment with street culture. The lower half of the ad transitions to a clear and crisp close-up of the shoe itself, spotlighting its design details such as the black and pink colorway and reinforced sole, indicating both aesthetic appeal and practical durability. This juxtaposition of action and product detail forms a compelling narrative that attracts the target market of youthful skateboarders or those inspired by the skate culture. By omitting any distracting text or overlays, the focus remains solely on the visuals, allowing the potential customer to envisage their own experiences and lifestyle aspirations intersecting with the product."
"5","2025-01-14","Vans","footwear","","studio/black background","rugged design;all-terrain capability;Vans MTE","adventure;product focus","The advertisement showcases Vans MTE shoes, emphasizing their rugged design and suitability for outdoor enthusiasts. Featuring three angled views of the shoes against a stark black background, the ad highlights the durable, intricately designed soles that promise traction and performance on various terrains. This visual choice underscores the brand's positioning as reliable footwear for adventures, blending functionality with stylish appeal. The use of minimalistic contrast ensures that the viewer's focus remains on the product's strengths, like its all-terrain capability and the Vans badge of quality. The ad leverages emotional appeals of confidence and the desire for exploration, targeting consumers who seek adventure without compromising style. By emphasizing these aspects, the advertisement effectively communicates its unique selling propositions, inviting consumers with the promise of durability and style in challenging outdoor settings. This approach not only reinforces Vans' brand identity but also engages potential customers by addressing common footwear needs in the outdoors."
"6","2025-01-30","REAL Skateboards","skateboard","","skate park","bold graphic deck;high performance;graffiti setting","high-energy;community","This advertisement showcases a skateboarder executing a dramatic trick in mid-air at a skate park pool. The emphasis is on the skateboard, featuring a bold graphic design with the brand name 'REAL Skateboards' visible. This high-energy image conveys the excitement and skill associated with skateboarding, appealing to both seasoned skaters and those aspiring to join the skateboarding community. The bright outdoor setting, complete with graffiti and a clear sky, enhances the rebellious and adventurous vibe of the sport. By focusing on a professional-looking skater in action, the ad implicitly positions the product as the choice of professionals, thereby appealing to those who seek reliability and high performance in their skateboarding gear. The ad's effectiveness lies in its ability to capture a moment of peak performance, embodying the brand's promise of quality and experience, and creating a compelling emotional connection with its target audience."
"7","2025-01-14","Unknown","apparel","","urban street (winter)","layered winter clothing;puffed jackets;warmth and style","realistic depiction;community;comfort","The advertisement effectively captures the essence of casual winter wear by showcasing three individuals in an urban setting. With one seated person showing relaxed engagement and another standing by, the camaraderie is evident, suggesting comfort and warmth. They are dressed in layered winter clothing, featuring a mix of puffed jackets, camouflage pants, and beanies, clearly designed for cold weather. The background is a typical urban street scene with white and red building facades, enhancing the casual feel and making the product relevant for everyday use. The ad draws attention through its realistic depiction of style meeting function, presenting a compelling visual narrative of warmth, style, and casual comfort. By utilizing natural human interaction, the viewer associates the product with community and everyday functionality. It works without overly relying on text, letting the scenario and clothing emphasis speak to efficacy in real-world applications."
"8","2025-01-30","Unknown","footwear","","studio/yellow background","skate shoes;contrast color design;vibrant style","youth culture;trendiness","The advertisement prominently features a pair of skate shoes against a vibrant yellow background. This setting creates an immediate visual impact, drawing the viewer's attention toward the shoes' stylish design and quality. The use of contrasting colors not only highlights the product but also aligns it with youth culture and modern trends, essential factors for appealing to its target demographics. These skate shoes are positioned as not only functional for skaters but also suitable for day-to-day fashion, bridging the gap between performance footwear and lifestyle wear. The detailed stitching and robust construction suggest durability and quality, key attributes for both skaters and everyday users. The image is simple yet effective, lacking textual clutter, allowing the design and the implication of high performance to speak for themselves. This approach persuades viewers not just with practical features, but by insinuating that owning these shoes facilitates inclusion in a trendy, active lifestyle."
"9","2025-01-14","Unknown","footwear","","urban/low-lit","trail running shoes;distinctive tread;high-energy action","safety-conscious;adventure","The advertisement brilliantly showcases the product's capabilities through a high-energy action shot of a person leaping over an urban obstacle. This image effectively highlights the strength and grip of the trail running shoes, specifically focusing on the sole's distinctive tread pattern. The setting is intentionally low-lit, adding to the sense of challenge and adventure, while the urban backdrop underscores the shoes' utility across diverse environments. The ad aims to resonate with thrill-seekers and safety-conscious consumers, using visual storytelling techniques that put the stakes and capabilities of the shoes at the forefront. There is a clear emphasis on overcoming obstacles, which becomes a metaphor for the footwear's potential to conquer any terrain. The intention is to communicate safety and reliability while appealing to those who have an adventurous spirit, making it a compelling visual narrative for potential buyers. The absence of text overlays keeps the focus on the imagery, allowing the product's features to speak for themselves through the action-oriented scene."
"10","2025-01-14","Vans","footwear","","studio/textured background","multiple Vans sneaker models;vibrant soles;brand heritage","trendiness;lifestyle","This advertisement effectively showcases a variety of Vans sneakers, emphasizing their style and versatility. The flat lay presentation on a textured background highlights different models, which are positioned to display their unique features such as vibrant soles and iconic brand patterns. The natural lighting enhances the colors and textures, making the sneakers appear appealing and stylish. The ad targets a youthful audience through its casual yet trendy styling, appealing to their aspirations for fashionable and comfortable footwear. By emphasizing a variety of designs, Vans positions itself as a versatile brand, suitable for multiple occasions, from casual outings to daily activities. The strategic use of known brand qualities like trusted designs and comfort accentuates Vans as a favorite choice among sneaker enthusiasts. Overall, the ad communicates an effective blend of style, comfort, and brand heritage, making it compelling for the target market."
"11","2025-01-30","Unknown","footwear","","abandoned skate park","skate shoes;reinforced stitching;cushioned sole","urban lifestyle;FOMO","The advertisement features a pair of skate shoes, designed for performance and style, captured against a gritty urban backdrop. This setting, an abandoned skate park, immediately resonates with the target audience of skaters and those who embrace urban lifestyles. The shoes, prominently displayed in the foreground, highlight key features such as reinforced stitching and a cushioned sole, essential for comfort and durability during skating. The color scheme is modern, aligning with current trends and appealing to younger demographics. The ad's effectiveness lies in its ability to seamlessly associate the product with the lifestyle of its users, offering a solution to a common skater problem: finding shoes that balance durability and aesthetics. It uses visual storytelling effectively by placing the shoes in a relatable, real-world environment, making it easy for potential customers to picture themselves wearing them. The psychological principle of FOMO is subtly leveraged, encouraging viewers not to miss out on a stylish, high-performance shoe that's 'skater-approved'."
"12","2025-01-17","Vans","footwear","red;black","studio/tan background","Valentine’s Day theme;heart motifs;limited edition","FOMO;emotional appeal","The advertisement showcases a vibrant collection of Vans shoes with a distinct Valentine's Day theme. Various sneakers are arranged on a tan background with a red overlay, creating a warm, festive atmosphere. The use of heart motifs and the predominant red and black color scheme align with the Valentine's Day theme, appealing to those looking for special occasion footwear. The positioning of the shoes in the image allows for each design's unique features to be appreciated, indicating a well-curated selection for the target market. The ad leverages psychological principles such as scarcity and emotional appeal, playing on the fear of missing out on a limited edition collection. Overall, the use of thematic imagery and colors effectively communicates the celebratory message, urging potential buyers to consider these stylish yet expressive options for Valentine's Day. This ad effectively captivates its audience through visual storytelling and strategic thematic elements."
"13","2025-01-30","Unknown","footwear","white","concrete surface","canvas sneakers;durable;versatile staple","minimalistic;lifestyle","This advertisement image effectively showcases a pair of classic white canvas sneakers, a staple in casual footwear due to its appeal to style and functionality. The sneakers, with their intricate details like white laces, soft canvas material, and a neutral color palette, rest on a rugged, textured concrete surface. This setting not only highlights the product but also suggests durability and everyday use, appealing to consumers seeking versatile and fashionable options. The image is devoid of text overlays, relying solely on the powerful visual capture to convey the sneakers' aesthetic appeal. The natural shadows and lighting enrich the photo, creating a sense of the sneakers being part of a real-world, urban setting. This creates relatability and enhances the emotional reach to a broad audience. The advertisement leverages simplicity, design, and context, making it memorable and effective through its straightforward yet compelling presentation."
"14","2025-01-14","Vans","footwear","grey","snow","winter-ready;improved grip;stylish in snow","functionality;comfort","This advertisement features a close-up visual of Vans sneakers, primarily focusing on how they function in a snowy environment. The meticulous attention to capturing the shoes within a blanket of snow immediately communicates the product's key selling point: a stylish sneaker that adapts to winter conditions. The shoes presented are of a sleek grey design, ensuring it maintains the brand's image of chic, urban fashion while highlighting practical functionality. The background—pure white snow—serves as a high-contrast backdrop that not only makes the product stand out but also reinforces its unique winter-ready features. Descriptive messaging around the practical benefits of improved grip and comfort in cold weather targets consumers who value functionality without wanting to compromise on style. By embedding the product in a real-world setting, the ad appeals to the consumer's lifestyle aspirations, making the viewer believe that these sneakers seamlessly fit within their daily winter activities, from casual outings to serious outdoor explorations."
"15","2025-01-14","Unknown","apparel/gear","","indoor/winter prep","snowboarding gear;warmth;reliability","adventure;aspiration","The advertisement vividly captures the moment of preparation for a snowboarding adventure, showcasing essential gear such as the snowboard, boots, and attire. Set in a cozy indoor environment, the ad effectively projects a sense of both adventure and comfort. The imagery is detailed, highlighting the quality and readiness of the gear. The person appears equipped and ready to head out, indicating the gear's reliability and necessity for such extreme sports activities. There's an implicit message about the importance of being well-prepared, subtly appealing to both current snowboarders and those aspiring to take up the sport. The combination of functionality and style in the visual elements makes the product attractive, tapping into the audience's desire for quality and experience enhancement. Overall, this ad successfully aligns its visual narrative with the core messaging, emphasizing key product benefits and appealing to the adventure-seeking instincts of the target consumer."
"16","2025-01-14","Vans","footwear","","urban/wet surface","water-resistant;durability;sturdy-looking","emotional appeal;practical focus","This Vans advertisement creatively highlights the durability and water-resistant qualities of their shoes using an urban outdoor setting. The image shows a close-up of the sturdy-looking shoes on a wet surface with visible water droplets, which directly illustrates the product’s key feature of water-resistance. The ad cleverly uses visual storytelling to showcase how the shoes withstand harsh environmental conditions, making it appealing for potential customers seeking reliable and stylish footwear for inclement weather. The contrasting texture and color between the wet background and the dry shoes emphasize the product’s functional benefits. This depiction taps into the emotional desire for security and assurance, making the viewer confident in the product’s reliability. Through strategic use of imagery, the advertisement not only draws attention but effectively communicates the shoe's ability to remain dry, bridging the emotional appeal of trust and the rational appeal of durability. Overall, the ad successfully integrates its core message into a visually compelling narrative, effectively driving home the product's unique selling proposition."
"17","2025-01-14","Vans","footwear","","studio/black background","rugged sole;streamlined design;fashion-forward","product-focused;sophistication","This Vans shoe advertisement is a brilliant display of product-focused marketing, aimed at demonstrating both the style and functionality of the footwear. The advertisement features three different angles of the shoes on a stark black background, allowing the potential consumer to appreciate the intricate details such as the rugged sole and streamlined design. This image meticulously captures the essence of the product's dual purpose—fashion-forward yet utilitarian. The black backdrop ensures the shoes are the focal point, highlighting details like the textured grip of the soles which symbolize the product's durability and performance qualities. The lack of clutter reinforces the brand's message of sophistication and functionality. The advertisement is effective due to its sharp focus on the product itself, allowing consumers to envision the shoes as versatile additions to their wardrobe—suitable for urban exploration or a casual outing. The imagery is paired with a sense of innovation and reliability, targeting consumers who value both aesthetics and product performance."
"18","2025-01-14","Vans","footwear","brown;red","outdoor/snowy","rugged terrain;winter conditions;adventurous","adventure;visual storytelling","This advertisement for Vans shoes is strategically designed to convey a blend of style and functionality. The shoes are prominently displayed on a snow-covered, rocky ground, immediately positioning them as rugged and able to withstand harsh winter conditions. This backdrop is more than just visually appealing; it serves to illustrate the key selling points of durability and outdoor readiness. The brown and red color scheme of the shoes is both striking and complementary to the natural environment, emphasizing the brand's positioning of merging fashion with practicality. This ad leverages the emotional appeal of adventure, inspiring potential buyers to imagine themselves exploring rugged terrains with confidence in their footwear. By choosing a realistic and challenging setting, the ad effectively communicates the product's benefits without needing excessive textual overlays, relying on visual storytelling to create an impactful message. The focus on the shoes in this dynamic environment makes the ad memorable and positions Vans as a go-to choice for those seeking a balance of style and resilience in their footwear."
"19","2025-01-14","Unknown","footwear","","urban/skate scenario","durability;skater-focused;real-world application","authentic lifestyle;aspirational","The advertisement effectively communicates its message by showcasing the product in use by a skater in a natural environment. The image catches an everyday moment of a skater tying his shoes, highlighting the product's style and utility. This real-world application and authentic lifestyle depiction reinforce brand credibility. The tangible focus on the shoe underscores its durability and design features, appealing directly to the target audience of skaters. The presence of the skater, likely representing the brand's demographic, further builds a connection with potential buyers. The advertisement employs visual tactics such as close-up shots to ensure the shoe is the focal point, enhancing the perception of quality and style. By immersing the viewer in a relatable skating context, the ad not only sells a product but also an aspirational lifestyle, effectively creating an emotional appeal and compelling call to action without overt selling tactics."
"20","2025-01-30","Vans","footwear","","skate park","stylish design;robust construction;cushioned sole","skater lifestyle;energetic","This advertisement features a close-up image of Vans shoes, focusing on the stylish and robust design of the footwear. The contrasting colors create a visual appeal that mirrors the brand's youthful and energetic identity. The presence of a skateboard subtly yet effectively ties the product to its target consumer base—active, youthful, and style-conscious individuals. The emphasis on the VANS logo, visible on the sock, reinforces brand recognition and loyalty. The outdoor setting suggests a skate park, evoking a sense of freedom and excitement associated with the sport, and making the ad highly relatable for skateboarding enthusiasts. The ad capitalizes on the psychological principles of aspiration and identity, drawing viewers into the realm of an energetic lifestyle. By associating the shoes with skateboarding—a popular sport and cultural trend—the brand reinforces its position as a staple in youthful and sporty fashion. This approach is highly effective in promoting not just a product, but a lifestyle."
"21","2025-01-14","Unknown","footwear","","outdoor/urban rooftop","trendy design;robust construction","comfort;casual style","The advertisement features a person sitting on a concrete platform wearing stylish sneakers. The individual is dressed in a relaxed tank top and red pants, suggestive of comfort and casual style. The backdrop of a clear, blue sky adds to an aspirational, carefree mood. The sneakers are the focal point of the image, showcasing both their trendy design and robust construction. This portrayal aligns with the core messaging of providing comfort without sacrificing style, making the footwear suitable for everyday adventures. The outdoor urban setting subtly implies that these sneakers are ideal for the modern, city-dwelling individual who values both functionality and aesthetics. This ad effectively uses lifestyle imagery to convey the brand's value proposition, appealing to consumers who aspire to integrate stylish, comfortable footwear into their daily lives."
"22","2025-01-17","Unknown","footwear","red;black","studio/gray background","heart motifs;easy slip-on","personal expression;exclusive feel","This advertisement showcases a slip-on shoe characterized by its distinctive design featuring red heart motifs against a black background. The ad encapsulates the essence of a trendy, fashion-forward lifestyle while delivering practicality through the shoe's easy-to-wear design. By focusing on a singular product view, it eliminates visual clutter, allowing the unique aspects of the design to shine. The strategic use of a plain gray background accentuates the shoe's vibrant design, creating a sharp contrast that emphasizes its boldness. This ad targets individuals passionate about fashion and self-expression, provoking a desire to own stylish yet comfortable footwear. The absence of text or additional components shifts the focus entirely to the visual appeal of the product, suggesting luxury and exclusivity. The emotion invoked through the heart motif taps into personal expression and individuality, aligning perfectly with today's consumer who seeks to stand out. Overall, the ad's effectiveness lies in its strong visual storytelling, appealing to emotions, and commitment to high product quality."
